<?xml version="1.0" encoding="utf-8"?>
<xs:schema xmlns:xs="http://www.w3.org/2001/XMLSchema" elementFormDefault="qualified">
    <xs:element name="cancion">
        <xs:complexType>
            <xs:sequence>
                <xs:element maxOccurs="unbounded" ref="texto"/>
            </xs:sequence>
        </xs:complexType>
    </xs:element>
    <xs:element name="texto">
        <xs:complexType>
            <xs:sequence>
                <xs:element minOccurs="0" ref="informacion"/>
                <xs:element ref="estrofa"/>
            </xs:sequence>
        </xs:complexType>
    </xs:element>
    <xs:element name="informacion">
        <xs:complexType>
            <xs:sequence>
                <xs:element ref="titulo"/>
                <xs:element ref="autor"/>
            </xs:sequence>
        </xs:complexType>
    </xs:element>
    <xs:element name="titulo" type="xs:string"/>
    <xs:element name="autor" type="xs:string"/>
    <xs:element name="estrofa">
        <xs:complexType>
            <xs:sequence>
                <xs:element ref="tipo"/>
                <xs:element ref="orden"/>
                <xs:element maxOccurs="unbounded" ref="verso"/>
            </xs:sequence>
        </xs:complexType>
    </xs:element>
    <xs:element name="tipo" type="xs:NCName"/>
    <xs:element name="orden" type="xs:integer"/>
    <xs:element name="verso" type="xs:string"/>
</xs:schema>
